smartctl 6.6 2017-11-05 r4594 [i686-w64-mingw32-win7(64)-sp1] (sf-6.6-1)
Copyright (C) 2002-17, Bruce Allen, Christian Franke, www.smartmontools.org

=== START OF INFORMATION SECTION ===
Model Family:     JMicron based SSDs
Device Model:     ADATA SP600
Serial Number:    2E5220007190
LU WWN Device Id: 5 707c18 1000ed532
Firmware Version: 5.2
User Capacity:    256,060,514,304 bytes [256 GB]
Sector Size:      512 bytes logical/physical
Rotation Rate:    Solid State Device
Form Factor:      < 1.8 inches
Device is:        In smartctl database [for details use: -P show]
ATA Version is:   ACS-2 (minor revision not indicated)
SATA Version is:  SATA 3.1, 6.0 Gb/s (current: 3.0 Gb/s)
Local Time is:    Sat Feb 10 13:36:19 2018 EST
SMART support is: Available - device has SMART capability.
SMART support is: Enabled
AAM feature is:   Unavailable
APM level is:     254 (maximum performance)
Rd look-ahead is: Enabled
Write cache is:   Enabled
DSN feature is:   Unavailable
ATA Security is:  Disabled, frozen [SEC2]
Wt Cache Reorder: Enabled

=== START OF READ SMART DATA SECTION ===
SMART overall-health self-assessment test result: PASSED

General SMART Values:
Offline data collection status:  (0x00)	Offline data collection activity
					was never started.
					Auto Offline Data Collection: Disabled.
Self-test execution status:      (   0)	The previous self-test routine completed
					without error or no self-test has ever 
					been run.
Total time to complete Offline 
data collection: 		(   32) seconds.
Offline data collection
capabilities: 			 (0x5b) SMART execute Offline immediate.
					Auto Offline data collection on/off support.
					Suspend Offline collection upon new
					command.
					Offline surface scan supported.
					Self-test supported.
					No Conveyance Self-test supported.
					Selective Self-test supported.
SMART capabilities:            (0x0003)	Saves SMART data before entering
					power-saving mode.
					Supports SMART auto save timer.
Error logging capability:        (0x01)	Error logging supported.
					General Purpose Logging supported.
Short self-test routine 
recommended polling time: 	 (   1) minutes.
Extended self-test routine
recommended polling time: 	 (   1) minutes.
SCT capabilities: 	       (0x0039)	SCT Status supported.
					SCT Error Recovery Control supported.
					SCT Feature Control supported.
					SCT Data Table supported.

SMART Attributes Data Structure revision number: 16
Vendor Specific SMART Attributes with Thresholds:
ID# ATTRIBUTE_NAME          FLAGS    VALUE WORST THRESH FAIL RAW_VALUE
  1 Raw_Read_Error_Rate     -O-R--   100   100   000    -    0
  2 Throughput_Performance  P-S---   100   100   050    -    0
  3 Unknown_JMF_Attribute   POS---   100   100   050    -    0
  5 Reallocated_Sector_Ct   PO--C-   100   100   050    -    0
  7 Unknown_JMF_Attribute   PO-R--   100   100   050    -    0
  8 Unknown_JMF_Attribute   P-S---   100   100   050    -    0
  9 Power_On_Hours          -O--C-   100   100   000    -    20537
 10 Unknown_JMF_Attribute   PO--C-   100   100   050    -    0
 12 Power_Cycle_Count       -O--C-   100   100   000    -    327
167 Unknown_JMF_Attribute   -O---K   100   100   000    -    0
168 SATA_Phy_Error_Count    -O--C-   100   100   000    -    33
169 Unknown_JMF_Attribute   PO--C-   100   100   010    -    4521991
170 Bad_Block_Count         PO--C-   100   100   010    -    0 0 0
173 Erase_Count             -O--C-   189   189   000    -    10 264 97
175 Bad_Cluster_Table_Count PO--C-   100   100   010    -    0
180 Unused_Rsvd_Blk_Cnt_Tot PO--CK   100   100   020    -    1035
192 Unexpect_Power_Loss_Ct  -O--C-   100   100   000    -    171
194 Temperature_Celsius     -O---K   075   075   030    -    25 (Min/Max 25/28)
197 Current_Pending_Sector  -O--C-   100   100   000    -    0
231 Temperature_Celsius     PO--CK   097   097   005    -    3
233 Unknown_JMF_Attribute   -O--CK   100   100   000    -    49272823040
234 Unknown_JMF_Attribute   -O--CK   100   100   000    -    64567010496
240 Unknown_JMF_Attribute   PO--C-   100   100   050    -    0
241 Total_LBAs_Written      -O--CK   100   100   000    -    12190204618
242 Total_LBAs_Read         -O--CK   100   100   000    -    15506508220
                            ||||||_ K auto-keep
                            |||||__ C event count
                            ||||___ R error rate
                            |||____ S speed/performance
                            ||_____ O updated online
                            |______ P prefailure warning

General Purpose Log Directory Version 1
SMART           Log Directory Version 1 [multi-sector log support]
Address    Access  R/W   Size  Description
0x00       GPL,SL  R/O      1  Log Directory
0x01           SL  R/O      1  Summary SMART error log
0x02           SL  R/O     51  Comprehensive SMART error log
0x03       GPL     R/O     64  Ext. Comprehensive SMART error log
0x04       GPL,SL  R/O      8  Device Statistics log
0x06           SL  R/O      1  SMART self-test log
0x07       GPL     R/O      1  Extended self-test log
0x09           SL  R/W      1  Selective self-test log
0x10       GPL     R/O      1  NCQ Command Error log
0x11       GPL     R/O      1  SATA Phy Event Counters log
0x30       GPL,SL  R/O      9  IDENTIFY DEVICE data log
0x80-0x9f  GPL,SL  R/W     16  Host vendor specific log
0xe0       GPL,SL  R/W      1  SCT Command/Status
0xe1       GPL,SL  R/W      1  SCT Data Transfer

SMART Extended Comprehensive Error Log Version: 1 (64 sectors)
Device Error Count: 1
	CR     = Command Register
	FEATR  = Features Register
	COUNT  = Count (was: Sector Count) Register
	LBA_48 = Upper bytes of LBA High/Mid/Low Registers ]  ATA-8
	LH     = LBA High (was: Cylinder High) Register    ]   LBA
	LM     = LBA Mid (was: Cylinder Low) Register      ] Register
	LL     = LBA Low (was: Sector Number) Register     ]
	DV     = Device (was: Device/Head) Register
	DC     = Device Control Register
	ER     = Error register
	ST     = Status register
Powered_Up_Time is measured from power on, and printed as
DDd+hh:mm:SS.sss where DD=days, hh=hours, mm=minutes,
SS=sec, and sss=millisec. It "wraps" after 49.710 days.

Error 1 [0] occurred at disk power-on lifetime: 6767 hours (281 days + 23 hours)
  When the command that caused the error occurred, the device was active or idle.

  After command completion occurred, registers were:
  ER -- ST COUNT  LBA_48  LH LM LL DV DC
  -- -- -- == -- == == == -- -- -- -- --
  84 -- 51 00 80 00 00 00 03 f4 90 e0 00  Error: ABRT

  Commands leading to the command that caused the error were:
  CR FEATR COUNT  LBA_48  LH LM LL DV DC  Powered_Up_Time  Command/Feature_Name
  -- == -- == -- == == == -- -- -- -- --  ---------------  --------------------

SMART Extended Self-test Log Version: 1 (1 sectors)
No self-tests have been logged.  [To run self-tests, use: smartctl -t]

SMART Selective self-test log data structure revision number 1
 SPAN  MIN_LBA  MAX_LBA  CURRENT_TEST_STATUS
    1        0        0  Not_testing
    2        0        0  Not_testing
    3        0        0  Not_testing
    4        0        0  Not_testing
    5        0        0  Not_testing
Selective self-test flags (0x0):
  After scanning selected spans, do NOT read-scan remainder of disk.
If Selective self-test is pending on power-up, resume after 0 minute delay.

SCT Status Version:                  3
SCT Version (vendor specific):       1 (0x0001)
SCT Support Level:                   0
Device State:                        Active (0)
Current Temperature:                  0 Celsius
Power Cycle Max Temperature:          0 Celsius
Lifetime    Max Temperature:          0 Celsius

SCT Temperature History Version:     2
Temperature Sampling Period:         1 minute
Temperature Logging Interval:        1 minute
Min/Max recommended Temperature:     -127/127 Celsius
Min/Max Temperature Limit:           -127/127 Celsius
Temperature History Size (Index):    478 (385)

Index    Estimated Time   Temperature Celsius
 386    2018-02-10 05:39    29  **********
 ...    ..(  4 skipped).    ..  **********
 391    2018-02-10 05:44    29  **********
 392    2018-02-10 05:45    28  *********
 393    2018-02-10 05:46    28  *********
 394    2018-02-10 05:47    27  ********
 ...    ..(  6 skipped).    ..  ********
 401    2018-02-10 05:54    27  ********
 402    2018-02-10 05:55    26  *******
 403    2018-02-10 05:56    26  *******
 404    2018-02-10 05:57    26  *******
 405    2018-02-10 05:58    27  ********
 ...    ..(  6 skipped).    ..  ********
 412    2018-02-10 06:05    27  ********
 413    2018-02-10 06:06    26  *******
 ...    ..( 21 skipped).    ..  *******
 435    2018-02-10 06:28    26  *******
 436    2018-02-10 06:29    27  ********
 ...    ..(  5 skipped).    ..  ********
 442    2018-02-10 06:35    27  ********
 443    2018-02-10 06:36    28  *********
 ...    ..( 14 skipped).    ..  *********
 458    2018-02-10 06:51    28  *********
 459    2018-02-10 06:52    27  ********
 ...    ..(  7 skipped).    ..  ********
 467    2018-02-10 07:00    27  ********
 468    2018-02-10 07:01    28  *********
 ...    ..(  9 skipped).    ..  *********
   0    2018-02-10 07:11    28  *********
   1    2018-02-10 07:12    27  ********
   2    2018-02-10 07:13    28  *********
   3    2018-02-10 07:14    27  ********
   4    2018-02-10 07:15    28  *********
   5    2018-02-10 07:16    27  ********
 ...    ..(  3 skipped).    ..  ********
   9    2018-02-10 07:20    27  ********
  10    2018-02-10 07:21    26  *******
 ...    ..(  4 skipped).    ..  *******
  15    2018-02-10 07:26    26  *******
  16    2018-02-10 07:27    27  ********
  17    2018-02-10 07:28    27  ********
  18    2018-02-10 07:29    27  ********
  19    2018-02-10 07:30    28  *********
 ...    ..(  3 skipped).    ..  *********
  23    2018-02-10 07:34    28  *********
  24    2018-02-10 07:35    29  **********
 ...    ..( 19 skipped).    ..  **********
  44    2018-02-10 07:55    29  **********
  45    2018-02-10 07:56    28  *********
  46    2018-02-10 07:57    28  *********
  47    2018-02-10 07:58    25  ******
  48    2018-02-10 07:59    25  ******
  49    2018-02-10 08:00    26  *******
  50    2018-02-10 08:01    26  *******
  51    2018-02-10 08:02    25  ******
  52    2018-02-10 08:03    26  *******
  53    2018-02-10 08:04    26  *******
  54    2018-02-10 08:05    26  *******
  55    2018-02-10 08:06    25  ******
  56    2018-02-10 08:07    27  ********
  57    2018-02-10 08:08    26  *******
  58    2018-02-10 08:09    25  ******
 ...    ..(  2 skipped).    ..  ******
  61    2018-02-10 08:12    25  ******
  62    2018-02-10 08:13    26  *******
  63    2018-02-10 08:14    26  *******
  64    2018-02-10 08:15    28  *********
  65    2018-02-10 08:16    28  *********
  66    2018-02-10 08:17    25  ******
  67    2018-02-10 08:18    27  ********
  68    2018-02-10 08:19    29  **********
 ...    ..(  3 skipped).    ..  **********
  72    2018-02-10 08:23    29  **********
  73    2018-02-10 08:24    28  *********
  74    2018-02-10 08:25    28  *********
  75    2018-02-10 08:26    27  ********
  76    2018-02-10 08:27    27  ********
  77    2018-02-10 08:28    26  *******
  78    2018-02-10 08:29    26  *******
  79    2018-02-10 08:30    26  *******
  80    2018-02-10 08:31    25  ******
  81    2018-02-10 08:32    26  *******
  82    2018-02-10 08:33    27  ********
  83    2018-02-10 08:34    27  ********
  84    2018-02-10 08:35    26  *******
  85    2018-02-10 08:36    27  ********
  86    2018-02-10 08:37    25  ******
  87    2018-02-10 08:38    25  ******
  88    2018-02-10 08:39    25  ******
  89    2018-02-10 08:40    27  ********
  90    2018-02-10 08:41    27  ********
  91    2018-02-10 08:42    26  *******
  92    2018-02-10 08:43    25  ******
  93    2018-02-10 08:44    25  ******
  94    2018-02-10 08:45    27  ********
  95    2018-02-10 08:46    27  ********
  96    2018-02-10 08:47    29  **********
  97    2018-02-10 08:48    28  *********
 ...    ..(  2 skipped).    ..  *********
 100    2018-02-10 08:51    28  *********
 101    2018-02-10 08:52    29  **********
 102    2018-02-10 08:53    29  **********
 103    2018-02-10 08:54    30  ***********
 104    2018-02-10 08:55    29  **********
 ...    ..(  4 skipped).    ..  **********
 109    2018-02-10 09:00    29  **********
 110    2018-02-10 09:01    28  *********
 ...    ..(  3 skipped).    ..  *********
 114    2018-02-10 09:05    28  *********
 115    2018-02-10 09:06    27  ********
 ...    ..( 17 skipped).    ..  ********
 133    2018-02-10 09:24    27  ********
 134    2018-02-10 09:25    28  *********
 135    2018-02-10 09:26    27  ********
 ...    ..( 21 skipped).    ..  ********
 157    2018-02-10 09:48    27  ********
 158    2018-02-10 09:49    26  *******
 ...    ..( 25 skipped).    ..  *******
 184    2018-02-10 10:15    26  *******
 185    2018-02-10 10:16     ?  -
 186    2018-02-10 10:17     ?  -
 187    2018-02-10 10:18    26  *******
 188    2018-02-10 10:19    27  ********
 189    2018-02-10 10:20    28  *********
 ...    ..(  2 skipped).    ..  *********
 192    2018-02-10 10:23    28  *********
 193    2018-02-10 10:24    27  ********
 ...    ..(  4 skipped).    ..  ********
 198    2018-02-10 10:29    27  ********
 199    2018-02-10 10:30    26  *******
 200    2018-02-10 10:31    26  *******
 201    2018-02-10 10:32    25  ******
 ...    ..(  4 skipped).    ..  ******
 206    2018-02-10 10:37    25  ******
 207    2018-02-10 10:38    26  *******
 208    2018-02-10 10:39    27  ********
 ...    ..(  3 skipped).    ..  ********
 212    2018-02-10 10:43    27  ********
 213    2018-02-10 10:44    26  *******
 214    2018-02-10 10:45    26  *******
 215    2018-02-10 10:46    26  *******
 216    2018-02-10 10:47    25  ******
 ...    ..(  3 skipped).    ..  ******
 220    2018-02-10 10:51    25  ******
 221    2018-02-10 10:52    27  ********
 ...    ..(  3 skipped).    ..  ********
 225    2018-02-10 10:56    27  ********
 226    2018-02-10 10:57    26  *******
 227    2018-02-10 10:58    26  *******
 228    2018-02-10 10:59    26  *******
 229    2018-02-10 11:00    25  ******
 ...    ..(  4 skipped).    ..  ******
 234    2018-02-10 11:05    25  ******
 235    2018-02-10 11:06    26  *******
 236    2018-02-10 11:07    26  *******
 237    2018-02-10 11:08    27  ********
 238    2018-02-10 11:09    27  ********
 239    2018-02-10 11:10    27  ********
 240    2018-02-10 11:11    26  *******
 241    2018-02-10 11:12    26  *******
 242    2018-02-10 11:13    26  *******
 243    2018-02-10 11:14    27  ********
 ...    ..(  6 skipped).    ..  ********
 250    2018-02-10 11:21    27  ********
 251    2018-02-10 11:22    28  *********
 252    2018-02-10 11:23    27  ********
 ...    ..( 95 skipped).    ..  ********
 348    2018-02-10 12:59    27  ********
 349    2018-02-10 13:00    26  *******
 ...    ..( 16 skipped).    ..  *******
 366    2018-02-10 13:17    26  *******
 367    2018-02-10 13:18    25  ******
 368    2018-02-10 13:19    25  ******
 369    2018-02-10 13:20    25  ******
 370    2018-02-10 13:21    26  *******
 371    2018-02-10 13:22    25  ******
 372    2018-02-10 13:23    25  ******
 373    2018-02-10 13:24    25  ******
 374    2018-02-10 13:25    26  *******
 375    2018-02-10 13:26    25  ******
 ...    ..(  9 skipped).    ..  ******
 385    2018-02-10 13:36    25  ******

SCT Error Recovery Control:
           Read:     70 (7.0 seconds)
          Write:     70 (7.0 seconds)

Device Statistics (GP Log 0x04)
Page  Offset Size        Value Flags Description
0x01  =====  =               =  ===  == General Statistics (rev 2) ==
0x01  0x008  4             327  ---  Lifetime Power-On Resets
0x01  0x018  6     12190143546  ---  Logical Sectors Written
0x01  0x020  6       202774076  ---  Number of Write Commands
0x01  0x028  6     15506492952  ---  Logical Sectors Read
0x01  0x030  6       138575124  ---  Number of Read Commands
0x01  0x038  6     73933200000  ---  Date and Time TimeStamp
0x07  =====  =               =  ===  == Solid State Device Statistics (rev 1) ==
0x07  0x008  1              10  N--  Percentage Used Endurance Indicator
                                |||_ C monitored condition met
                                ||__ D supports DSN
                                |___ N normalized value

Pending Defects log (GP Log 0x0c) not supported

SATA Phy Event Counters (GP Log 0x11)
ID      Size     Value  Description
0x0001  2           33  Command failed due to ICRC error
0x0003  2            1  R_ERR response for device-to-host data FIS
0x0004  2            0  R_ERR response for host-to-device data FIS
0x0006  2            0  R_ERR response for device-to-host non-data FIS
0x0007  2            0  R_ERR response for host-to-device non-data FIS
0x0008  2            0  Device-to-host non-data FIS retries
0x0009  4            0  Transition from drive PhyRdy to drive PhyNRdy
0x000a  4         1263  Device-to-host register FISes sent due to a COMRESET
0x000f  2            0  R_ERR response for host-to-device data FIS, CRC
0x0010  2            0  R_ERR response for host-to-device data FIS, non-CRC
0x0012  2            0  R_ERR response for host-to-device non-data FIS, CRC
0x0013  2            0  R_ERR response for host-to-device non-data FIS, non-CRC

