smartctl 6.6 2017-11-05 r4594 [x86_64-w64-mingw32-win7-sp1] (sf-6.6-1)
Copyright (C) 2002-17, Bruce Allen, Christian Franke, www.smartmontools.org

=== START OF INFORMATION SECTION ===
Model Family:     Crucial/Micron RealSSD m4/C400/P400
Device Model:     MTFDDAK256MAM-1K12
Serial Number:    12040336F754
Firmware Version: 07TA
Device is:        In smartctl database [for details use: -P show]
ATA Version is:   [No Information Found]
Local Time is:    Sat Feb 10 14:27:15 2018 EST
SMART support is: Available - device has SMART capability.
                  Enabled status cached by OS, trying SMART RETURN STATUS cmd.
SMART support is: Enabled
AAM feature is:   Unavailable
APM feature is:   Unavailable
Rd look-ahead is: Unavailable
Write cache is:   Unavailable
DSN feature is:   Unavailable
ATA Security is:  Unavailable
Wt Cache Reorder: Unavailable

Read SMART Thresholds failed: Function not implemented

=== START OF READ SMART DATA SECTION ===
SMART overall-health self-assessment test result: PASSED

General SMART Values:
Offline data collection status:  (0x00)	Offline data collection activity
					was never started.
					Auto Offline Data Collection: Disabled.
Self-test execution status:      (   0)	The previous self-test routine completed
					without error or no self-test has ever 
					been run.
Total time to complete Offline 
data collection: 		( 1190) seconds.
Offline data collection
capabilities: 			 (0x7b) SMART execute Offline immediate.
					Auto Offline data collection on/off support.
					Suspend Offline collection upon new
					command.
					Offline surface scan supported.
					Self-test supported.
					Conveyance Self-test supported.
					Selective Self-test supported.
SMART capabilities:            (0x0003)	Saves SMART data before entering
					power-saving mode.
					Supports SMART auto save timer.
Error logging capability:        (0x01)	Error logging supported.
					No General Purpose Logging support.
Short self-test routine 
recommended polling time: 	 (   2) minutes.
Extended self-test routine
recommended polling time: 	 (  19) minutes.
Conveyance self-test routine
recommended polling time: 	 (   3) minutes.

SMART Attributes Data Structure revision number: 16
Vendor Specific SMART Attributes with Thresholds:
ID# ATTRIBUTE_NAME          FLAGS    VALUE WORST THRESH FAIL RAW_VALUE
  1 Raw_Read_Error_Rate     POSR-K   100   100   ---    -    0
  5 Reallocated_Sector_Ct   PO--CK   100   100   ---    -    0
  9 Power_On_Hours          -O--CK   100   100   ---    -    6694
 12 Power_Cycle_Count       -O--CK   100   100   ---    -    2787
170 Grown_Failing_Block_Ct  PO--CK   100   100   ---    -    0
171 Program_Fail_Count      -O--CK   100   100   ---    -    0
172 Erase_Fail_Count        -O--CK   100   100   ---    -    0
173 Wear_Leveling_Count     PO--CK   099   099   ---    -    43
174 Unexpect_Power_Loss_Ct  -O--CK   100   100   ---    -    28
181 Non4k_Aligned_Access    -O---K   100   100   ---    -    3299 983 2315
183 SATA_Iface_Downshift    -O--CK   100   100   ---    -    0
184 End-to-End_Error        PO--CK   100   100   ---    -    0
187 Reported_Uncorrect      -O--CK   100   100   ---    -    0
188 Command_Timeout         -O--CK   100   100   ---    -    0
189 Factory_Bad_Block_Ct    -OSR--   100   100   ---    -    88
194 Temperature_Celsius     -O---K   100   100   ---    -    0
195 Hardware_ECC_Recovered  -O-RCK   100   100   ---    -    0
196 Reallocated_Event_Count -O--CK   100   100   ---    -    0
197 Current_Pending_Sector  -O--CK   100   100   ---    -    0
198 Offline_Uncorrectable   ----CK   100   100   ---    -    0
199 UDMA_CRC_Error_Count    -OS-CK   100   100   ---    -    0
202 Perc_Rated_Life_Used    ---RC-   099   099   ---    -    1
206 Write_Error_Rate        -OSR--   100   100   ---    -    0
                            ||||||_ K auto-keep
                            |||||__ C event count
                            ||||___ R error rate
                            |||____ S speed/performance
                            ||_____ O updated online
                            |______ P prefailure warning

Read SMART Log Directory failed: Function not implemented

General Purpose Log Directory not supported

SMART Extended Comprehensive Error Log (GP Log 0x03) not supported

Read SMART Error Log failed: Function not implemented

SMART Extended Self-test Log (GP Log 0x07) not supported

Read SMART Self-test Log failed: Function not implemented

Read SMART Selective Self-test Log failed: Function not implemented

SCT Commands not supported

Device Statistics (GP/SMART Log 0x04) not supported

Pending Defects log (GP Log 0x0c) not supported

SATA Phy Event Counters (GP Log 0x11) not supported

