smartctl 6.6 2017-11-05 r4594 [i686-w64-mingw32-win7(64)-sp1] (sf-6.6-1)
Copyright (C) 2002-17, Bruce Allen, Christian Franke, www.smartmontools.org

=== START OF INFORMATION SECTION ===
Model Family:     Seagate Momentus 7200.4
Device Model:     ST9500420AS
Serial Number:    5VJ5CQRC
LU WWN Device Id: 5 000c50 024aafe71
Firmware Version: 0003SDM1
User Capacity:    500,107,862,016 bytes [500 GB]
Sector Size:      512 bytes logical/physical
Rotation Rate:    7200 rpm
Device is:        In smartctl database [for details use: -P show]
ATA Version is:   ATA8-ACS T13/1699-D revision 4
SATA Version is:  SATA 2.6, 3.0 Gb/s
Local Time is:    Sat Feb 10 14:29:39 2018 EST
SMART support is: Available - device has SMART capability.
SMART support is: Enabled
AAM feature is:   Disabled
APM level is:     128 (minimum power consumption without standby)
Rd look-ahead is: Enabled
Write cache is:   Enabled
DSN feature is:   Unavailable
ATA Security is:  Disabled, frozen [SEC2]
Wt Cache Reorder: Unknown

=== START OF READ SMART DATA SECTION ===
SMART overall-health self-assessment test result: PASSED

General SMART Values:
Offline data collection status:  (0x00)	Offline data collection activity
					was never started.
					Auto Offline Data Collection: Disabled.
Self-test execution status:      (   0)	The previous self-test routine completed
					without error or no self-test has ever 
					been run.
Total time to complete Offline 
data collection: 		(    0) seconds.
Offline data collection
capabilities: 			 (0x73) SMART execute Offline immediate.
					Auto Offline data collection on/off support.
					Suspend Offline collection upon new
					command.
					No Offline surface scan supported.
					Self-test supported.
					Conveyance Self-test supported.
					Selective Self-test supported.
SMART capabilities:            (0x0003)	Saves SMART data before entering
					power-saving mode.
					Supports SMART auto save timer.
Error logging capability:        (0x01)	Error logging supported.
					General Purpose Logging supported.
Short self-test routine 
recommended polling time: 	 (   2) minutes.
Extended self-test routine
recommended polling time: 	 ( 107) minutes.
Conveyance self-test routine
recommended polling time: 	 (   3) minutes.
SCT capabilities: 	       (0x103f)	SCT Status supported.
					SCT Error Recovery Control supported.
					SCT Feature Control supported.
					SCT Data Table supported.

SMART Attributes Data Structure revision number: 10
Vendor Specific SMART Attributes with Thresholds:
ID# ATTRIBUTE_NAME          FLAGS    VALUE WORST THRESH FAIL RAW_VALUE
  1 Raw_Read_Error_Rate     POSR--   111   099   006    -    35040872
  3 Spin_Up_Time            PO----   098   097   085    -    0
  4 Start_Stop_Count        -O--CK   099   099   020    -    1318
  5 Reallocated_Sector_Ct   PO--CK   100   100   036    -    0
  7 Seek_Error_Rate         POSR--   072   060   030    -    14782769
  9 Power_On_Hours          -O--CK   084   084   000    -    14540
 10 Spin_Retry_Count        PO--C-   100   100   097    -    0
 12 Power_Cycle_Count       -O--CK   099   099   020    -    1282
184 End-to-End_Error        -O--CK   100   100   099    -    0
187 Reported_Uncorrect      -O--CK   100   100   000    -    0
188 Command_Timeout         -O--CK   100   098   000    -    31
189 High_Fly_Writes         -O-RCK   100   100   000    -    0
190 Airflow_Temperature_Cel -O---K   079   049   045    -    21 (Min/Max 20/21)
191 G-Sense_Error_Rate      -O--CK   100   100   000    -    3
192 Power-Off_Retract_Count -O--CK   100   100   000    -    7
193 Load_Cycle_Count        -O--CK   097   097   000    -    6547
194 Temperature_Celsius     -O---K   021   051   000    -    21 (0 18 0 0 0)
195 Hardware_ECC_Recovered  -O-RC-   051   045   000    -    35040872
197 Current_Pending_Sector  -O--C-   100   100   000    -    0
198 Offline_Uncorrectable   ----C-   100   100   000    -    0
199 UDMA_CRC_Error_Count    -OSRCK   200   200   000    -    0
240 Head_Flying_Hours       ------   100   253   000    -    14336 (252 25 0)
241 Total_LBAs_Written      ------   100   253   000    -    2329255879
242 Total_LBAs_Read         ------   100   253   000    -    1168851754
254 Free_Fall_Sensor        -O--CK   100   100   000    -    0
                            ||||||_ K auto-keep
                            |||||__ C event count
                            ||||___ R error rate
                            |||____ S speed/performance
                            ||_____ O updated online
                            |______ P prefailure warning

General Purpose Log Directory Version 1
SMART           Log Directory Version 1 [multi-sector log support]
Address    Access  R/W   Size  Description
0x00       GPL,SL  R/O      1  Log Directory
0x01       GPL,SL  R/O      1  Summary SMART error log
0x02       GPL,SL  R/O      5  Comprehensive SMART error log
0x03       GPL,SL  R/O      5  Ext. Comprehensive SMART error log
0x06       GPL,SL  R/O      1  SMART self-test log
0x07       GPL,SL  R/O      1  Extended self-test log
0x09       GPL,SL  R/W      1  Selective self-test log
0x10       GPL,SL  R/O      1  NCQ Command Error log
0x11       GPL,SL  R/O      1  SATA Phy Event Counters log
0x21       GPL,SL  R/O      1  Write stream error log
0x22       GPL,SL  R/O      1  Read stream error log
0x80-0x9f  GPL,SL  R/W     16  Host vendor specific log
0xa1       GPL,SL  VS      20  Device vendor specific log
0xa2       GPL     VS    2248  Device vendor specific log
0xa8       GPL,SL  VS      65  Device vendor specific log
0xa9       GPL,SL  VS       1  Device vendor specific log
0xb0       GPL     VS    2864  Device vendor specific log
0xbe-0xbf  GPL     VS   65535  Device vendor specific log
0xe0       GPL,SL  R/W      1  SCT Command/Status
0xe1       GPL,SL  R/W      1  SCT Data Transfer

SMART Extended Comprehensive Error Log Version: 1 (5 sectors)
No Errors Logged

SMART Extended Self-test Log Version: 1 (1 sectors)
No self-tests have been logged.  [To run self-tests, use: smartctl -t]

SMART Selective self-test log data structure revision number 1
 SPAN  MIN_LBA  MAX_LBA  CURRENT_TEST_STATUS
    1        0        0  Not_testing
    2        0        0  Not_testing
    3        0        0  Not_testing
    4        0        0  Not_testing
    5        0        0  Not_testing
Selective self-test flags (0x0):
  After scanning selected spans, do NOT read-scan remainder of disk.
If Selective self-test is pending on power-up, resume after 0 minute delay.

SCT Status Version:                  3
SCT Version (vendor specific):       522 (0x020a)
SCT Support Level:                   1
Device State:                        Active (0)
Current Temperature:                    20 Celsius
Power Cycle Min/Max Temperature:     20/20 Celsius
Lifetime    Min/Max Temperature:     18/51 Celsius
Lifetime    Average Temperature:        38 Celsius
Under/Over Temperature Limit Count:   0/0

SCT Temperature History Version:     2
Temperature Sampling Period:         1 minute
Temperature Logging Interval:        1 minute
Min/Max recommended Temperature:     14/55 Celsius
Min/Max Temperature Limit:           10/60 Celsius
Temperature History Size (Index):    128 (102)

Index    Estimated Time   Temperature Celsius
 103    2018-02-10 12:22    25  ******
 104    2018-02-10 12:23    26  *******
 105    2018-02-10 12:24    34  ***************
 106    2018-02-10 12:25    30  ***********
 107    2018-02-10 12:26     ?  -
 108    2018-02-10 12:27    24  *****
 109    2018-02-10 12:28    24  *****
 110    2018-02-10 12:29     ?  -
 111    2018-02-10 12:30    22  ***
 112    2018-02-10 12:31    23  ****
 113    2018-02-10 12:32    24  *****
 114    2018-02-10 12:33    25  ******
 115    2018-02-10 12:34     ?  -
 116    2018-02-10 12:35    26  *******
 117    2018-02-10 12:36    28  *********
 118    2018-02-10 12:37     ?  -
 119    2018-02-10 12:38    23  ****
 120    2018-02-10 12:39    24  *****
 121    2018-02-10 12:40    25  ******
 122    2018-02-10 12:41    26  *******
 123    2018-02-10 12:42    29  **********
 124    2018-02-10 12:43    29  **********
 125    2018-02-10 12:44    35  ****************
 126    2018-02-10 12:45     ?  -
 127    2018-02-10 12:46    23  ****
   0    2018-02-10 12:47    25  ******
   1    2018-02-10 12:48    26  *******
   2    2018-02-10 12:49    26  *******
   3    2018-02-10 12:50    27  ********
   4    2018-02-10 12:51    27  ********
   5    2018-02-10 12:52    28  *********
   6    2018-02-10 12:53    29  **********
   7    2018-02-10 12:54    29  **********
   8    2018-02-10 12:55    30  ***********
   9    2018-02-10 12:56    30  ***********
  10    2018-02-10 12:57    30  ***********
  11    2018-02-10 12:58    31  ************
  12    2018-02-10 12:59    31  ************
  13    2018-02-10 13:00    27  ********
  14    2018-02-10 13:01    26  *******
  15    2018-02-10 13:02    27  ********
  16    2018-02-10 13:03    28  *********
  17    2018-02-10 13:04    26  *******
  18    2018-02-10 13:05    26  *******
  19    2018-02-10 13:06    27  ********
  20    2018-02-10 13:07    27  ********
  21    2018-02-10 13:08    28  *********
  22    2018-02-10 13:09    28  *********
  23    2018-02-10 13:10    29  **********
  24    2018-02-10 13:11    29  **********
  25    2018-02-10 13:12    29  **********
  26    2018-02-10 13:13    30  ***********
 ...    ..(  2 skipped).    ..  ***********
  29    2018-02-10 13:16    30  ***********
  30    2018-02-10 13:17    31  ************
 ...    ..(  2 skipped).    ..  ************
  33    2018-02-10 13:20    31  ************
  34    2018-02-10 13:21    32  *************
 ...    ..(  4 skipped).    ..  *************
  39    2018-02-10 13:26    32  *************
  40    2018-02-10 13:27    33  **************
 ...    ..(  9 skipped).    ..  **************
  50    2018-02-10 13:37    33  **************
  51    2018-02-10 13:38    34  ***************
 ...    ..(  2 skipped).    ..  ***************
  54    2018-02-10 13:41    34  ***************
  55    2018-02-10 13:42    33  **************
  56    2018-02-10 13:43    27  ********
  57    2018-02-10 13:44    27  ********
  58    2018-02-10 13:45    30  ***********
  59    2018-02-10 13:46     ?  -
  60    2018-02-10 13:47    23  ****
  61    2018-02-10 13:48    24  *****
  62    2018-02-10 13:49    26  *******
  63    2018-02-10 13:50    27  ********
  64    2018-02-10 13:51    28  *********
  65    2018-02-10 13:52     ?  -
  66    2018-02-10 13:53    26  *******
  67    2018-02-10 13:54    30  ***********
  68    2018-02-10 13:55    31  ************
  69    2018-02-10 13:56    30  ***********
  70    2018-02-10 13:57    32  *************
  71    2018-02-10 13:58    30  ***********
  72    2018-02-10 13:59    30  ***********
  73    2018-02-10 14:00     ?  -
  74    2018-02-10 14:01    21  **
  75    2018-02-10 14:02    22  ***
  76    2018-02-10 14:03    23  ****
  77    2018-02-10 14:04    26  *******
  78    2018-02-10 14:05    27  ********
  79    2018-02-10 14:06    28  *********
  80    2018-02-10 14:07     ?  -
  81    2018-02-10 14:08    21  **
  82    2018-02-10 14:09    23  ****
  83    2018-02-10 14:10    23  ****
  84    2018-02-10 14:11    26  *******
  85    2018-02-10 14:12    26  *******
  86    2018-02-10 14:13    24  *****
  87    2018-02-10 14:14     ?  -
  88    2018-02-10 14:15    20  *
  89    2018-02-10 14:16    22  ***
  90    2018-02-10 14:17    23  ****
  91    2018-02-10 14:18     ?  -
  92    2018-02-10 14:19    21  **
  93    2018-02-10 14:20    22  ***
  94    2018-02-10 14:21    23  ****
  95    2018-02-10 14:22    25  ******
  96    2018-02-10 14:23    25  ******
  97    2018-02-10 14:24    29  **********
  98    2018-02-10 14:25    29  **********
  99    2018-02-10 14:26    28  *********
 100    2018-02-10 14:27     ?  -
 101    2018-02-10 14:28    20  *
 102    2018-02-10 14:29    20  *

SCT Error Recovery Control:
           Read: Disabled
          Write: Disabled

Device Statistics (GP/SMART Log 0x04) not supported

Pending Defects log (GP Log 0x0c) not supported

SATA Phy Event Counters (GP Log 0x11)
ID      Size     Value  Description
0x000a  2            2  Device-to-host register FISes sent due to a COMRESET
0x0001  2            0  Command failed due to ICRC error
0x0003  2            0  R_ERR response for device-to-host data FIS
0x0004  2            0  R_ERR response for host-to-device data FIS
0x0006  2            0  R_ERR response for device-to-host non-data FIS
0x0007  2            0  R_ERR response for host-to-device non-data FIS

