smartctl 6.6 2017-11-05 r4594 [i686-w64-mingw32-w10-1703(64)] (sf-6.6-1)
Copyright (C) 2002-17, Bruce Allen, Christian Franke, www.smartmontools.org

=== START OF INFORMATION SECTION ===
Model Family:     Hitachi Travelstar 5K500.B
Device Model:     Hitachi HTS545050B9A300
Serial Number:    101224PBN403X7DK4MUL
LU WWN Device Id: 5 000cca 67cd5e33a
Firmware Version: PB4OC60F
User Capacity:    500,107,862,016 bytes [500 GB]
Sector Size:      512 bytes logical/physical
Rotation Rate:    5400 rpm
Form Factor:      2.5 inches
Device is:        In smartctl database [for details use: -P show]
ATA Version is:   ATA8-ACS T13/1699-D revision 6
SATA Version is:  SATA 2.6, 3.0 Gb/s
Local Time is:    Sat Feb 10 13:48:41 2018 EST
SMART support is: Available - device has SMART capability.
SMART support is: Enabled
AAM feature is:   Disabled
APM level is:     128 (minimum power consumption without standby)
Rd look-ahead is: Enabled
Write cache is:   Enabled
DSN feature is:   Unavailable
ATA Security is:  Disabled, frozen [SEC2]
Wt Cache Reorder: Enabled

=== START OF READ SMART DATA SECTION ===
SMART overall-health self-assessment test result: PASSED

General SMART Values:
Offline data collection status:  (0x00)	Offline data collection activity
					was never started.
					Auto Offline Data Collection: Disabled.
Self-test execution status:      (   0)	The previous self-test routine completed
					without error or no self-test has ever 
					been run.
Total time to complete Offline 
data collection: 		(  645) seconds.
Offline data collection
capabilities: 			 (0x5b) SMART execute Offline immediate.
					Auto Offline data collection on/off support.
					Suspend Offline collection upon new
					command.
					Offline surface scan supported.
					Self-test supported.
					No Conveyance Self-test supported.
					Selective Self-test supported.
SMART capabilities:            (0x0003)	Saves SMART data before entering
					power-saving mode.
					Supports SMART auto save timer.
Error logging capability:        (0x01)	Error logging supported.
					General Purpose Logging supported.
Short self-test routine 
recommended polling time: 	 (   2) minutes.
Extended self-test routine
recommended polling time: 	 ( 158) minutes.
SCT capabilities: 	       (0x003d)	SCT Status supported.
					SCT Error Recovery Control supported.
					SCT Feature Control supported.
					SCT Data Table supported.

SMART Attributes Data Structure revision number: 16
Vendor Specific SMART Attributes with Thresholds:
ID# ATTRIBUTE_NAME          FLAGS    VALUE WORST THRESH FAIL RAW_VALUE
  1 Raw_Read_Error_Rate     PO-R--   100   100   062    -    0
  2 Throughput_Performance  P-S---   100   100   040    -    0
  3 Spin_Up_Time            POS---   151   151   033    -    2
  4 Start_Stop_Count        -O--C-   099   099   000    -    1757
  5 Reallocated_Sector_Ct   PO--CK   100   100   005    -    0
  7 Seek_Error_Rate         PO-R--   100   100   067    -    0
  8 Seek_Time_Performance   P-S---   100   100   040    -    0
  9 Power_On_Hours          -O--C-   087   087   000    -    5987
 10 Spin_Retry_Count        PO--C-   100   100   060    -    0
 12 Power_Cycle_Count       -O--CK   100   100   000    -    1214
191 G-Sense_Error_Rate      -O-R--   100   100   000    -    0
192 Power-Off_Retract_Count -O--CK   099   099   000    -    362
193 Load_Cycle_Count        -O--C-   086   086   000    -    143271
194 Temperature_Celsius     -O----   166   166   000    -    33 (Min/Max 6/46)
196 Reallocated_Event_Count -O--CK   100   100   000    -    0
197 Current_Pending_Sector  -O---K   100   100   000    -    0
198 Offline_Uncorrectable   ---R--   100   100   000    -    0
199 UDMA_CRC_Error_Count    -O-R--   200   200   000    -    0
223 Load_Retry_Count        -O-R--   100   100   000    -    0
                            ||||||_ K auto-keep
                            |||||__ C event count
                            ||||___ R error rate
                            |||____ S speed/performance
                            ||_____ O updated online
                            |______ P prefailure warning

General Purpose Log Directory Version 1
SMART           Log Directory Version 1 [multi-sector log support]
Address    Access  R/W   Size  Description
0x00       GPL,SL  R/O      1  Log Directory
0x01           SL  R/O      1  Summary SMART error log
0x02           SL  R/O      1  Comprehensive SMART error log
0x03       GPL     R/O      1  Ext. Comprehensive SMART error log
0x06           SL  R/O      1  SMART self-test log
0x07       GPL     R/O      1  Extended self-test log
0x09           SL  R/W      1  Selective self-test log
0x10       GPL     R/O      1  NCQ Command Error log
0x11       GPL     R/O      1  SATA Phy Event Counters log
0x80-0x9f  GPL,SL  R/W     16  Host vendor specific log
0xe0       GPL,SL  R/W      1  SCT Command/Status
0xe1       GPL,SL  R/W      1  SCT Data Transfer

SMART Extended Comprehensive Error Log Version: 1 (1 sectors)
No Errors Logged

SMART Extended Self-test Log Version: 1 (1 sectors)
No self-tests have been logged.  [To run self-tests, use: smartctl -t]

SMART Selective self-test log data structure revision number 1
 SPAN  MIN_LBA  MAX_LBA  CURRENT_TEST_STATUS
    1        0        0  Not_testing
    2        0        0  Not_testing
    3        0        0  Not_testing
    4        0        0  Not_testing
    5        0        0  Not_testing
Selective self-test flags (0x0):
  After scanning selected spans, do NOT read-scan remainder of disk.
If Selective self-test is pending on power-up, resume after 0 minute delay.

SCT Status Version:                  3
SCT Version (vendor specific):       256 (0x0100)
SCT Support Level:                   1
Device State:                        Active (0)
Current Temperature:                    33 Celsius
Power Cycle Min/Max Temperature:     32/33 Celsius
Lifetime    Min/Max Temperature:      6/46 Celsius
Lifetime    Average Temperature:        32 Celsius
Under/Over Temperature Limit Count:   0/0

SCT Temperature History Version:     2
Temperature Sampling Period:         1 minute
Temperature Logging Interval:        1 minute
Min/Max recommended Temperature:      5/60 Celsius
Min/Max Temperature Limit:           -40/65 Celsius
Temperature History Size (Index):    478 (253)

Index    Estimated Time   Temperature Celsius
 254    2018-02-10 05:51    28  *********
 ...    ..( 19 skipped).    ..  *********
 274    2018-02-10 06:11    28  *********
 275    2018-02-10 06:12    29  **********
 ...    ..(  2 skipped).    ..  **********
 278    2018-02-10 06:15    29  **********
 279    2018-02-10 06:16    30  ***********
 ...    ..(  4 skipped).    ..  ***********
 284    2018-02-10 06:21    30  ***********
 285    2018-02-10 06:22    31  ************
 ...    ..( 21 skipped).    ..  ************
 307    2018-02-10 06:44    31  ************
 308    2018-02-10 06:45    30  ***********
 ...    ..( 11 skipped).    ..  ***********
 320    2018-02-10 06:57    30  ***********
 321    2018-02-10 06:58    31  ************
 ...    ..( 15 skipped).    ..  ************
 337    2018-02-10 07:14    31  ************
 338    2018-02-10 07:15    17  -
 339    2018-02-10 07:16    17  -
 340    2018-02-10 07:17    18  -
 341    2018-02-10 07:18    19  -
 342    2018-02-10 07:19    20  *
 343    2018-02-10 07:20    17  -
 344    2018-02-10 07:21    17  -
 345    2018-02-10 07:22    18  -
 346    2018-02-10 07:23    18  -
 347    2018-02-10 07:24    19  -
 348    2018-02-10 07:25    20  *
 349    2018-02-10 07:26    20  *
 350    2018-02-10 07:27    21  **
 351    2018-02-10 07:28    21  **
 352    2018-02-10 07:29    22  ***
 353    2018-02-10 07:30    23  ****
 354    2018-02-10 07:31    24  *****
 355    2018-02-10 07:32    24  *****
 356    2018-02-10 07:33    25  ******
 357    2018-02-10 07:34    26  *******
 358    2018-02-10 07:35    26  *******
 359    2018-02-10 07:36    26  *******
 360    2018-02-10 07:37    27  ********
 361    2018-02-10 07:38    27  ********
 362    2018-02-10 07:39    28  *********
 ...    ..(  3 skipped).    ..  *********
 366    2018-02-10 07:43    28  *********
 367    2018-02-10 07:44    29  **********
 ...    ..(  3 skipped).    ..  **********
 371    2018-02-10 07:48    29  **********
 372    2018-02-10 07:49    30  ***********
 ...    ..( 13 skipped).    ..  ***********
 386    2018-02-10 08:03    30  ***********
 387    2018-02-10 08:04    31  ************
 ...    ..( 21 skipped).    ..  ************
 409    2018-02-10 08:26    31  ************
 410    2018-02-10 08:27    32  *************
 ...    ..( 14 skipped).    ..  *************
 425    2018-02-10 08:42    32  *************
 426    2018-02-10 08:43    33  **************
 ...    ..( 15 skipped).    ..  **************
 442    2018-02-10 08:59    33  **************
 443    2018-02-10 09:00    32  *************
 ...    ..(  3 skipped).    ..  *************
 447    2018-02-10 09:04    32  *************
 448    2018-02-10 09:05    33  **************
 ...    ..(  3 skipped).    ..  **************
 452    2018-02-10 09:09    33  **************
 453    2018-02-10 09:10    32  *************
 ...    ..(  3 skipped).    ..  *************
 457    2018-02-10 09:14    32  *************
 458    2018-02-10 09:15    31  ************
 ...    ..(  3 skipped).    ..  ************
 462    2018-02-10 09:19    31  ************
 463    2018-02-10 09:20    32  *************
 ...    ..( 34 skipped).    ..  *************
  20    2018-02-10 09:55    32  *************
  21    2018-02-10 09:56    31  ************
  22    2018-02-10 09:57    31  ************
  23    2018-02-10 09:58    32  *************
 ...    ..( 18 skipped).    ..  *************
  42    2018-02-10 10:17    32  *************
  43    2018-02-10 10:18    33  **************
  44    2018-02-10 10:19    33  **************
  45    2018-02-10 10:20    33  **************
  46    2018-02-10 10:21    32  *************
  47    2018-02-10 10:22    33  **************
  48    2018-02-10 10:23    32  *************
  49    2018-02-10 10:24    33  **************
 ...    ..(  4 skipped).    ..  **************
  54    2018-02-10 10:29    33  **************
  55    2018-02-10 10:30    32  *************
  56    2018-02-10 10:31    32  *************
  57    2018-02-10 10:32    32  *************
  58    2018-02-10 10:33    33  **************
  59    2018-02-10 10:34    32  *************
 ...    ..( 39 skipped).    ..  *************
  99    2018-02-10 11:14    32  *************
 100    2018-02-10 11:15    31  ************
 ...    ..(  2 skipped).    ..  ************
 103    2018-02-10 11:18    31  ************
 104    2018-02-10 11:19    33  **************
 ...    ..(  7 skipped).    ..  **************
 112    2018-02-10 11:27    33  **************
 113    2018-02-10 11:28    32  *************
 ...    ..( 19 skipped).    ..  *************
 133    2018-02-10 11:48    32  *************
 134    2018-02-10 11:49    33  **************
 ...    ..(  9 skipped).    ..  **************
 144    2018-02-10 11:59    33  **************
 145    2018-02-10 12:00    34  ***************
 ...    ..( 14 skipped).    ..  ***************
 160    2018-02-10 12:15    34  ***************
 161    2018-02-10 12:16    33  **************
 ...    ..(  6 skipped).    ..  **************
 168    2018-02-10 12:23    33  **************
 169    2018-02-10 12:24    32  *************
 170    2018-02-10 12:25    33  **************
 ...    ..(  4 skipped).    ..  **************
 175    2018-02-10 12:30    33  **************
 176    2018-02-10 12:31    32  *************
 ...    ..(  3 skipped).    ..  *************
 180    2018-02-10 12:35    32  *************
 181    2018-02-10 12:36    33  **************
 ...    ..(  7 skipped).    ..  **************
 189    2018-02-10 12:44    33  **************
 190    2018-02-10 12:45    32  *************
 ...    ..( 13 skipped).    ..  *************
 204    2018-02-10 12:59    32  *************
 205    2018-02-10 13:00    33  **************
 ...    ..(  4 skipped).    ..  **************
 210    2018-02-10 13:05    33  **************
 211    2018-02-10 13:06    20  *
 212    2018-02-10 13:07    20  *
 213    2018-02-10 13:08    21  **
 214    2018-02-10 13:09    22  ***
 215    2018-02-10 13:10    22  ***
 216    2018-02-10 13:11    22  ***
 217    2018-02-10 13:12    23  ****
 218    2018-02-10 13:13    24  *****
 219    2018-02-10 13:14    25  ******
 220    2018-02-10 13:15    25  ******
 221    2018-02-10 13:16    26  *******
 222    2018-02-10 13:17    27  ********
 223    2018-02-10 13:18    28  *********
 224    2018-02-10 13:19    28  *********
 225    2018-02-10 13:20    29  **********
 226    2018-02-10 13:21    30  ***********
 227    2018-02-10 13:22    30  ***********
 228    2018-02-10 13:23    30  ***********
 229    2018-02-10 13:24    31  ************
 230    2018-02-10 13:25    31  ************
 231    2018-02-10 13:26    32  *************
 232    2018-02-10 13:27    18  -
 233    2018-02-10 13:28    19  -
 234    2018-02-10 13:29    20  *
 235    2018-02-10 13:30    20  *
 236    2018-02-10 13:31    21  **
 237    2018-02-10 13:32    22  ***
 238    2018-02-10 13:33    23  ****
 239    2018-02-10 13:34    23  ****
 240    2018-02-10 13:35    24  *****
 241    2018-02-10 13:36    25  ******
 242    2018-02-10 13:37    26  *******
 243    2018-02-10 13:38    28  *********
 244    2018-02-10 13:39    28  *********
 245    2018-02-10 13:40    32  *************
 ...    ..(  3 skipped).    ..  *************
 249    2018-02-10 13:44    32  *************
 250    2018-02-10 13:45    33  **************
 ...    ..(  2 skipped).    ..  **************
 253    2018-02-10 13:48    33  **************

SCT Error Recovery Control:
           Read: Disabled
          Write: Disabled

Device Statistics (GP/SMART Log 0x04) not supported

Pending Defects log (GP Log 0x0c) not supported

SATA Phy Event Counters (GP Log 0x11)
ID      Size     Value  Description
0x0001  2            0  Command failed due to ICRC error
0x0002  2            0  R_ERR response for data FIS
0x0005  2            0  R_ERR response for non-data FIS
0x0009  2          362  Transition from drive PhyRdy to drive PhyNRdy
0x000a  2            2  Device-to-host register FISes sent due to a COMRESET
0x000b  2            0  CRC errors within host-to-device FIS
0x000d  2            0  Non-CRC errors within host-to-device FIS

